<?xml version="1.0" encoding="UTF-8"?>
<!-- edited with XMLSPY v2004 rel. 3 U (http://www.xmlspy.com) by Tim Chisholm (BBC) -->
<!--DTD generated by XMLSPY v2004 rel. 3 U (http://www.xmlspy.com)-->
<!ELEMENT workstations (workstation+)>
<!ELEMENT workstation EMPTY>
<!ATTLIST workstation
	id CDATA #REQUIRED
	name CDATA #REQUIRED
	user CDATA #REQUIRED
>
